Breed,Affectionate With Family,Good With Young Children,Good With Other Dogs,Shedding Level,Coat Grooming Frequency,Drooling Level,Coat Type,Coat Length,Openness To Strangers,Playfulness Level,Watchdog/Protective Nature,Adaptability Level,Trainability Level,Energy Level,Barking Level,Mental Stimulation Needs,links,Image,description,min_height,max_height,min_weight,max_weight,min_expectancy,max_expectancy,group
French Bulldog,5,5,4,3,1,3,Smooth,Short,5,5,3,5,4,3,1,3,https://www.akc.org/dog-breeds/french-bulldog/,https://www.akc.org/wp-content/uploads/2017/11/French-Bulldog-Illo-2.jpg,"The French Bulldog resembles a Bulldog in miniature, except for the large, erect “bat ears” that are the breed’s trademark feature. The head is large and square, with heavy wrinkles rolled above the extremely short nose. The body beneath the smooth, brilliant coat is compact and muscular.The bright, affectionate Frenchie is a charmer. Dogs of few words, Frenchies don’t bark much—but their alertness makes them excellent watchdogs. They happily adapt to life with singles, couples, or families, and do not require a lot of outdoor exercise. They get on well with other animals and enjoy making new friends of the human variety. It is no wonder that city folk from Paris to Peoria swear by this vastly amusing and companionable breed. The one-of-a-kind French Bulldog, with his large bat ears and even disposition, is one of the world’s most popular small-dog breeds, especially among city dwellers. The Frenchie is playful, alert, adaptable, and completely irresistible.",27.94,33.02,12.70058636,12.70058636,10.0,12.0,Non-Sporting Group
German Shepherd Dog,5,5,3,4,2,2,Double,Medium,3,4,5,5,5,5,3,5,https://www.akc.org/dog-breeds/german-shepherd-dog/,https://www.akc.org/wp-content/uploads/2017/11/German-Shepherd-Dog-Illo-2.jpg,"German Shepherd Dogs can stand as high as 26 inches at the shoulder and, when viewed in outline, presents a picture of smooth, graceful curves rather than angles. The natural gait is a free-and-easy trot, but they can turn it up a notch or two and reach great speeds.There are many reasons why German Shepherds stand in the front rank of canine royalty, but experts say their defining attribute is character: loyalty, courage, confidence, the ability to learn commands for many tasks, and the willingness to put their life on the line in defense of loved ones. German Shepherds will be gentle family pets and steadfast guardians, but, the breed standard says, there’s a “certain aloofness that does not lend itself to immediate and indiscriminate friendships.” Generally considered dogkind’s finest all-purpose worker, the German Shepherd Dog is a large, agile, muscular dog of noble character and high intelligence. Loyal, confident, courageous, and steady, the German Shepherd is truly a dog lover’s delight.",55.88,66.04,22.6796185,40.8233133,7.0,10.0,Herding Group
Bulldog,4,3,3,3,3,3,Smooth,Short,4,4,3,3,4,3,2,3,https://www.akc.org/dog-breeds/bulldog/,https://www.akc.org/wp-content/uploads/2017/11/Bulldog-Illo-2.jpg,"You can’t mistake a Bulldog for any other breed. The loose skin of the head, furrowed brow, pushed-in nose, small ears, undershot jaw with hanging chops on either side, and the distinctive rolling gait all practically scream “I’m a Bulldog!” The coat, seen in a variety of colors and patterns, is short, smooth, and glossy. Bulldogs can weigh up to 50 pounds, but that won’t stop them from curling up in your lap, or at least trying to. But don’t mistake their easygoing ways for laziness—Bulldogs enjoy brisk walks and need regular moderate exercise, along with a careful diet, to stay trim. Summer afternoons are best spent in an air-conditioned room as a Bulldog’s short snout can cause labored breathing in hot and humid weather. Kind but courageous, friendly but dignified, the Bulldog is a thick-set, low-slung, well-muscled bruiser whose “sourmug” face is the universal symbol of courage and tenacity. These docile, loyal companions adapt well to town or country.",35.56,38.1,18.1436948,22.6796185,8.0,10.0,Non-Sporting Group
Beagle,3,5,5,3,2,1,Smooth,Short,3,4,2,4,3,4,4,4,https://www.akc.org/dog-breeds/beagle/,https://www.akc.org/wp-content/uploads/2017/11/Beagle-Illo-2.jpg,"There are two Beagle varieties: those standing under 13 inches at the shoulder, and those between 13 and 15 inches. Both varieties are sturdy, solid, and “big for their inches,” as dog folks say. They come in such pleasing colors as lemon, red and white, and tricolor. The Beagle’s fortune is in his adorable face, with its big brown or hazel eyes set off by long, houndy ears set low on a broad head.A breed described as “merry” by its fanciers, Beagles are loving and lovable, happy, and companionable—all qualities that make them excellent family dogs. No wonder that for years the Beagle has been the most popular hound dog among American pet owners. These are curious, clever, and energetic hounds who require plenty of playtime. Not only is the Beagle an excellent hunting dog and loyal companion, it is also happy-go-lucky, funny, and—thanks to its pleading expression—cute. They were bred to hunt in packs, so they enjoy company and are generally easygoing.",33.02,38.1,5.8967008100000005,13.6077711,10.0,15.0,Hound Group
Rottweiler,5,3,3,3,1,3,Smooth,Short,3,4,5,4,5,3,1,5,https://www.akc.org/dog-breeds/rottweiler/,https://www.akc.org/wp-content/uploads/2017/11/Rottweiler-Illo-2.jpg,"A male Rottweiler will stand anywhere from 24 to 27 muscular inches at the shoulder; females run a bit smaller and lighter. The glistening, short black coat with smart rust markings add to the picture of imposing strength. A thickly muscled hindquarters powers the Rottie’s effortless trotting gait.A well-bred and properly raised Rottie will be calm and confident, courageous but not unduly aggressive. The aloof demeanor these world-class guardians present to outsiders belies the playfulness, and downright silliness, that endear Rotties to their loved ones. (No one told the Rottie he’s not a toy breed, so he is liable plop onto your lap for a cuddle.) Early training and socialization will harness a Rottie’s territorial instincts in a positive way. The Rottweiler is a robust working breed of great strength descended from the mastiffs of the Roman legions. A gentle playmate and protector within the family circle, the Rottie observes the outside world with a self-assured aloofness.",55.88,68.58,36.2873896,61.23496995,9.0,10.0,Working Group
Dachshund,5,3,4,2,2,2,Smooth,Short,4,4,4,4,4,3,5,3,https://www.akc.org/dog-breeds/dachshund/,https://www.akc.org/wp-content/uploads/2017/11/Dachshund-Illo-2.jpg,"The word “icon” is terribly overworked, but the Dachshund—with his unmistakable long-backed body, little legs, and big personality—is truly an icon of purebred dogdom. Dachshunds can be standard-sized (usually 16 to 32 pounds) or miniature (11 pounds or under), and come in one of three coat types: smooth, wirehaired, or longhaired.Dachshunds aren’t built for distance running, leaping, or strenuous swimming, but otherwise these tireless hounds are game for anything. Smart and vigilant, with a big-dog bark, they make fine watchdogs. Bred to be an independent hunter of dangerous prey, they can be brave to the point of rashness, and a bit stubborn, but their endearing nature and unique look has won millions of hearts the world over. The famously long, low silhouette, ever-alert expression, and bold, vivacious personality of the Dachshund have made him a superstar of the canine kingdom. Dachshunds come in two sizes and in three coat types of various colors and patterns.",12.7,22.86,4.9895160700000005,14.51495584,12.0,16.0,Hound Group
Pembroke Welsh Corgi,5,3,4,4,2,1,Double,Short,4,4,5,4,4,4,4,4,https://www.akc.org/dog-breeds/pembroke-welsh-corgi/,https://www.akc.org/wp-content/uploads/2017/11/Pembroke-Welsh-Corgi-Illo-2.jpg,"At 10 to 12 inches at the shoulder and 27 to 30 pounds, a well-built male Pembroke presents a big dog in a small package. Short but powerful legs, muscular thighs, and a deep chest equip him for a hard day’s work. Built long and low, Pembrokes are surprisingly quick and agile. They can be red, sable, fawn, and black and tan, with or without white markings.The Pembroke is a bright, sensitive dog who enjoys play with his human family and responds well to training. As herders bred to move cattle, they are fearless and independent. They are vigilant watchdogs, with acute senses and a “big dog” bark. Families who can meet their bold but kindly Pembroke’s need for activity and togetherness will never have a more loyal, loving pet. Among the most agreeable of all small housedogs, the Pembroke Welsh Corgi is a strong, athletic, and lively little herder who is affectionate and companionable without being needy. They are one of the world's most popular herding breeds.",25.4,30.48,12.70058636,13.6077711,12.0,13.0,Herding Group
Australian Shepherd,3,5,3,3,2,1,Double,Medium,3,4,3,3,5,5,3,5,https://www.akc.org/dog-breeds/australian-shepherd/,https://www.akc.org/wp-content/uploads/2017/11/Australian-Shepherd-Illo-2.jpg,"The Australian Shepherd, the cowboy’s herding dog of choice, is a medium-sized worker with a keen, penetrating gaze in the eye. Aussie coats offer different looks, including merle (a mottled pattern with contrasting shades of blue or red). In all ways, they’re the picture of rugged and agile movers of stock. Aussies exhibit an irresistible impulse to herd, anything: birds, dogs, kids. This strong work drive can make Aussies too much dog for a sedentary pet owner. Aussies are remarkably intelligent, quite capable of hoodwinking an unsuspecting novice owner. In short, this isn’t the pet for everyone. But if you’re looking for a brainy, tireless, and trainable partner for work or sport, your search might end here. The Australian Shepherd, a lean, tough ranch dog, is one of those “only in America” stories: a European breed perfected in California by way of Australia. Fixtures on the rodeo circuit, they are closely associated with the cowboy life.",45.72,58.42,18.1436948,29.48350405,12.0,15.0,Herding Group
Yorkshire Terrier,5,5,3,1,5,1,Silky,Long,5,4,5,5,4,4,4,4,https://www.akc.org/dog-breeds/yorkshire-terrier/,https://www.akc.org/wp-content/uploads/2017/11/Yorkshire-Terrier-Illo-2.jpg,"The Yorkshire Terrier is a compact, toy-size terrier of no more than seven pounds whose crowning glory is a floor-length, silky coat of steel blue and a rich golden tan.Don’t let the Yorkie’s daintiness fool you. Tenacious, feisty, brave, and sometimes bossy, the Yorkie exhibits all the traits of a true terrier. Often named the most popular dog breed in various American cities, Yorkies pack lots of big-town attitude into a small but self-important package. They are favorites of urbanites the world over.Yorkies are long-lived and low-allergen (the coat is more like human hair than animal fur), and they make fine little watchdogs. This is a true “personality breed,” providing years of laughs, love, and close companionship. Beneath the dainty, glossy, floor-length coat of a Yorkshire Terrier beats the heart of a feisty, old-time terrier. Yorkies earned their living as ratters in mines and mills long before they became the beribboned lapdogs of Victorian ladies.",17.78,20.32,3.17514659,3.17514659,11.0,15.0,Toy Group
Boxer,4,5,3,2,2,3,Smooth,Short,4,4,4,3,4,4,3,4,https://www.akc.org/dog-breeds/boxer/,https://www.akc.org/wp-content/uploads/2017/11/Boxer-Illo-2.jpg,"A well-made Boxer in peak condition is an awesome sight. A male can stand as high as 25 inches at the shoulder; females run smaller. Their muscles ripple beneath a short, tight-fitting coat. The dark brown eyes and wrinkled forehead give the face an alert, curious look. The coat can be fawn or brindle, with white markings. Boxers move like the athletes they are named for: smooth and graceful, with a powerful forward thrust.Boxers are upbeat and playful. Their patience and protective nature have earned them a reputation as a great dog with children. They take the jobs of watchdog and family guardian seriously and will meet threats fearlessly. Boxers do best when exposed to a lot of people and other animals in early puppyhood. Loyalty, affection, intelligence, work ethic, and good looks: Boxers are the whole doggy package. Bright and alert, sometimes silly, but always courageous, the Boxer has been among America’s most popular dog breeds for a very long time.",54.61,63.5,6.80388555,36.2873896,10.0,12.0,Working Group
Great Dane,5,3,3,3,1,4,Smooth,Short,3,4,5,4,3,4,3,4,https://www.akc.org/dog-breeds/great-dane/,https://www.akc.org/wp-content/uploads/2017/11/Great-Dane-Illo-2.jpg,"As tall as 32 inches at the shoulder, Danes tower over most other dogs—and when standing on their hind legs, they are taller than most people. These powerful giants are the picture of elegance and balance, with the smooth and easy stride of born noblemen. The coat comes in different colors and patterns, perhaps the best-known being the black-and-white patchwork pattern known as “harlequin.”Despite their sweet nature, Danes are alert home guardians. Just the sight of these gentle giants is usually enough to make intruders think twice. But those foolish enough to mistake the breed’s friendliness for softness will meet a powerful foe of true courage and spirit. Patient with kids, Danes are people pleasers who make friends easily. The easygoing Great Dane, the mighty “Apollo of Dogs,” is a total joy to live with—but owning a dog of such imposing size, weight, and strength is a commitment not to be entered into lightly. This breed is indeed great, but not a Dane.",71.12,81.28,49.895160700000005,79.37866475,7.0,10.0,Working Group
Cavalier King Charles Spaniel,5,5,5,2,2,2,Wavy,Medium,4,3,3,3,4,3,3,3,https://www.akc.org/dog-breeds/cavalier-king-charles-spaniel/,https://www.akc.org/wp-content/uploads/2017/11/Cavalier-King-Charles-Spaniel-illo-2.jpg,"The Cavalier’s all-around beauty, regal grace, and even temper mark him as one of dogdom’s noblemen. A toy spaniel no more than 13 inches high, the Cavalier draws you in with his face: The sweet, gentle, melting expression emanating from large, round eyes is a breed hallmark. Another is the silky, richly-colored coat that can be one of four distinct varieties.Cavaliers may be aristocrats, but they gladly descend from their royal high horse for a backyard frolic or a squirrel chase. They get along nicely with children and other dogs. Adaptable Cavaliers do equally well with active owners and homebodies—they can be upbeat athletes or shameless couch potatoes, depending on an owner’s lifestyle. The Cavalier King Charles Spaniel wears his connection to British history in his breed’s name. Cavaliers are the best of two worlds, combining the gentle attentiveness of a toy breed with the verve and athleticism of a sporting spaniel.",30.48,33.02,5.8967008100000005,8.164662660000001,12.0,15.0,Toy Group
Doberman Pinscher,5,5,3,4,1,2,Smooth,Short,4,4,5,4,5,5,3,4,https://www.akc.org/dog-breeds/doberman-pinscher/,https://www.akc.org/wp-content/uploads/2017/11/Doberman-Pinscher-illustration.jpg,"Dobermans are compactly-built dogs—muscular, fast, and powerful—standing between 24 to 28 inches at the shoulder. The body is sleek but substantial, and is covered with a glistening coat of black, blue, red, or fawn, with rust markings. These elegant qualities, combined with a noble, wedge-shaped head and an easy, athletic way of moving have earned Dobermans a reputation as royalty in the canine kingdom. A well-conditioned Doberman on patrol will deter all but the most foolish intruder. Sleek and powerful, possessing both a magnificent physique and keen intelligence, the Doberman Pinscher is one of dogkind's noblemen. This incomparably fearless and vigilant breed stands proudly among the world's finest protection dogs.",60.96,71.12,27.2155422,45.359237,10.0,12.0,Working Group
Miniature Schnauzer,5,5,3,3,4,2,Wiry,Medium,3,4,4,5,5,3,5,4,https://www.akc.org/dog-breeds/miniature-schnauzer/,https://www.akc.org/wp-content/uploads/2017/11/Miniature-Schnauzer-Illo-2.jpg,"Stocky, robust little dogs standing 12 to 14 inches, Miniature Schnauzers were bred down from their larger cousins, Standard Schnauzers. The bushy beard and eyebrows give Minis a charming, human-like expression. The hard, wiry coat comes in three color patterns: salt and pepper, black and silver, and solid black. Created to be all-around farm dogs and ratters, they are tough, muscular, and fearless without being aggressive.The Miniature Schnauzer is a bright, friendly, trainable companion, small enough to adapt to apartment life but tireless enough to patrol acres of farmland. They get along well with other animals and kids. Minis are sturdy little guys and enjoy vigorous play. Home and family oriented, they make great watchdogs. The Miniature Schnauzer, the smallest of the three Schnauzer breeds, is a generally healthy, long-lived, and low-shedding companion. Add an outgoing personality, a portable size, and sporty good looks, and you’ve got an ideal family dog.",30.48,35.56,4.9895160700000005,9.0718474,12.0,15.0,Terrier Group
Shih Tzu,5,5,5,1,4,1,Double,Long,3,3,3,5,4,3,3,3,https://www.akc.org/dog-breeds/shih-tzu/,https://www.akc.org/wp-content/uploads/2017/11/Shih-Tzu-Illo-2.jpg,"Shih Tzu (pronounced in the West “sheed-zoo” or “sheet-su”; the Chinese say “sher-zer”), weighing between 9 to 16 pounds, and standing between 8 and 11 inches, are surprisingly solid for dogs their size. The coat, which comes in many colors, is worth the time you will put into it—few dogs are as beautiful as a well-groomed Shih Tzu.Being cute is a way of life for this lively charmer. The Shih Tzu is known to be especially affectionate with children. As a small dog bred to spend most of their day inside royal palaces, they make a great pet if you live in an apartment or lack a big backyard. Some dogs live to dig holes and chase cats, but a Shih Tzu’s idea of fun is sitting in your lap acting adorable as you try to watch TV. That face! Those big dark eyes looking up at you with that sweet expression! It’s no surprise that Shih Tzu owners have been so delighted with this little “Lion Dog” for a thousand years. Where Shih Tzu go, giggles and mischief follow.",22.86,26.67,4.082331330000001,7.25747792,10.0,18.0,Toy Group
Boston Terrier,5,5,4,2,2,1,Smooth,Short,5,5,3,3,4,4,2,3,https://www.akc.org/dog-breeds/boston-terrier/,https://www.akc.org/wp-content/uploads/2017/11/Boston-Terrier-Illo-2.jpg,"Boston Terriers are compact, short-tailed, well-balanced little dogs weighing no more than 25 pounds. The stylish “tuxedo” coat can be white and either black, brindle, or seal (black with a red cast when viewed in sun or bright light). The head is square, the muzzle is short, and the large, round eyes can shine with kindness, curiosity, or mischief. Ever alert to their surroundings, Bostons move with a jaunty, rhythmic step.It’s a safe bet that a breed named for a city—the Havanese or Brussels Griffon, for instance—will make an excellent urban pet. Bostons are no exception: they are sturdy but portable, people-oriented, and always up for a brisk walk to the park or outdoor cafe. A bright dog with a natural gift for comedy, the dapper Bostonian is a steady source of smiles. The Boston Terrier is a lively little companion recognized by his tight tuxedo jacket, sporty but compact body, and the friendly glow in his big, round eyes. His impeccable manners have earned him the nickname “The American Gentleman.”",38.1,43.18,5.4431084400000005,11.33980925,11.0,13.0,Non-Sporting Group
Bernese Mountain Dog,5,5,5,5,3,3,Double,Medium,4,4,3,4,4,4,3,3,https://www.akc.org/dog-breeds/bernese-mountain-dog/,https://www.akc.org/wp-content/uploads/2017/11/Bernese-Mountain-Dog-Illo-2.jpg,"The Bernese Mountain Dog is a large, sturdy worker who can stand over 27 inches at the shoulder. The thick, silky, and moderately long coat is tricolored: jet black, clear white, and rust. The distinctive markings on the coat and face are breed hallmarks and, combined with the intelligent gleam in the dark eyes, add to the Berner’s aura of majestic nobility. A hardy dog who thrives in cold weather, the Berner’s brain and brawn helped him multitask on the farms and pastures of Switzerland.Berners get along with the entire family and are particularly gentle with children, but they will often become more attached to one lucky human. Berners are imposing but not threatening, and they maintain an aloof dignity with strangers. Big, powerful, and built for hard work, the Bernese Mountain Dog is also strikingly beautiful and blessed with a sweet, affectionate nature. Berners are generally placid but are always up for a romp with the owner, whom they live to please.",58.42,69.85,31.751465900000003,52.16312255,7.0,10.0,Working Group
Pomeranian,5,3,3,2,3,1,Double,Long,3,3,4,4,3,3,4,3,https://www.akc.org/dog-breeds/pomeranian/,https://www.akc.org/wp-content/uploads/2017/11/Pomeranian-Illo-2.jpg,"The Pomeranian combines a tiny body (no more than seven pounds) and a commanding big-dog demeanor. The abundant double coat, with its frill extending over the chest and shoulders, comes in almost two dozen colors, and various patterns and markings, but is most commonly seen in orange or red.Alert and intelligent, Pomeranians are easily trained and make fine watchdogs and perky pets for families with children old enough to know the difference between a toy dog and a toy. Poms are active but can be exercised with indoor play and short walks, so they are content in both the city and suburbs. They will master tricks and games with ease, though their favorite activity is providing laughs and companionship to their special human. The tiny Pomeranian, long a favorite of royals and commoners alike, has been called the ideal companion. The glorious coat, smiling, foxy face, and vivacious personality have helped make the Pom one of the world's most popular toy breeds.",15.24,17.78,1.36077711,3.17514659,12.0,16.0,Toy Group
Havanese,5,5,5,2,3,1,Double,Long,5,5,3,5,4,3,4,3,https://www.akc.org/dog-breeds/havanese/,https://www.akc.org/wp-content/uploads/2017/11/Havanese-Illo-2.jpg,"Distinctive features of the Havanese include a curled-over tail and a gorgeous silky coat, which comes in a variety of colors. Some owners enjoy cording the coat, in the manner of a Puli, and others clip it short to reduce grooming time. Happily, Havenese are just as cute no matter what hairdo you give them.Their small but sturdy bodies, adaptable nature, and social skills make Havanese an ideal city dog, but they are content to be anywhere that they can command the attention of admirers young and old alike. Havanese, smart and trainable extroverts with the comic instincts of a born clown, are natural trick dogs. Havanese are also excellent watchdogs and take the job seriously, but will usually keep the barking to a minimum. Havanese, the only dog breed native to Cuba, are cheerful little dogs with a spring in their step and a gleam in their big, brown eyes. These vivacious and sociable companions are becoming especially popular with American city dwellers.",21.59,29.21,3.17514659,5.8967008100000005,14.0,16.0,Toy Group
Cane Corso,4,3,3,2,1,3,Smooth,Short,3,3,5,3,4,4,3,3,https://www.akc.org/dog-breeds/cane-corso/,https://www.akc.org/wp-content/uploads/2017/11/Cane-Corso-Illo-2.jpg,"At nearly 28 inches at the shoulder and often weighing more than 100 pounds, with a large head, alert expression, and muscles rippling beneath their short, stiff coat, Corsi are at a glance intimidating creatures. Their imposing appearance is their first line of defense against intruders. As one writer put it, “An understated air of cool competence, the kind of demeanor you’d expect from a professional bodyguard, is the breed’s trademark.”Corsi are intelligent, loyal, eager to please, versatile, and intensely loyal to their humans, but are also assertive and willful, and can end up owning an unwitting owner. As with any other big guardian dog, responsible breeding and early socialization with people and other dogs is vital. Smart, trainable, and of noble bearing, the assertive and confident Cane Corso is a peerless protector. The Corso’s lineage goes back to ancient Roman times, and the breed’s name roughly translates from the Latin as “bodyguard dog.”",59.69,69.85,0.0,0.0,9.0,12.0,Working Group
Shetland Sheepdog,5,5,5,3,3,1,Double,Long,2,5,5,5,5,4,5,4,https://www.akc.org/dog-breeds/shetland-sheepdog/,https://www.akc.org/wp-content/uploads/2017/11/Shetland-Sheepdog-Illo-2.jpg,"The Shetland Sheepdog is a small, active, and agile herding dog standing between 13 and 16 inches at the shoulder. The long coat is harsh and straight, with a dense undercoat, and comes in black, blue merle, and sable, with white markings. The coat, along with a long, wedge-shaped head; small, three-quarter erect ears; and deep-chested, level-backed torso, give Shelties the look of a rough-coated Collie in miniature.Bright and eager Shelties are easy trainers and world-class competitors in obedience, agility, and herding trials. They are sensitive and affectionate family dogs, highly in tune with the mood of the household. They like to bark and tend to be reserved toward strangers—two qualifications of an excellent watchdog. The Shetland Sheepdog, also known as the Sheltie, is an extremely intelligent, quick, and obedient herder from Scotland’s remote and rugged Shetland Islands. Shelties bear a strong family resemblance to their bigger cousin, the Collie.",33.02,40.64,6.80388555,11.33980925,12.0,14.0,Herding Group
