Bullmastiff,4,3,3,3,1,3,Smooth,Short,3,3,5,3,4,4,1,4,https://www.akc.org/dog-breeds/bullmastiff/,https://www.akc.org/wp-content/uploads/2017/11/Bullmastiff-Illo-2.jpg,"The Bullmastiff isn’t quite as large as his close cousin the Mastiff. Still, standing as high as 27 inches at the shoulder and weighing between 100 and 130 pounds, this is still a whole lot of dog. After the first impression made by the Bullmastiff’s size, it is the large, broad head that conveys the breed’s essence: the dark eyes, high-set V-shaped ears, and broad, deep muzzle all combine to present the intelligence, alertness, and confidence that make the Bullmastiff a world-class protector and family companion. Coats come in fawn, red, or brindle.These are biddable and reliable creatures, but as with any large guarding dog, owners must begin training and socialization early, while the puppy is still small enough to control. Fearless at work, docile at home, the Bullmastiff is a large, muscular guarder who pursued and held poachers in Merry Old England—merry, we suppose, for everyone but poachers. Bullmastiffs are the result of Bulldog and Mastiff crosses.",60.96,68.58,45.359237,58.9670081,7.0,9.0,Working Group
Samoyed,5,5,3,3,3,1,Double,Long,5,5,4,4,4,4,5,4,https://www.akc.org/dog-breeds/samoyed/,https://www.akc.org/wp-content/uploads/2017/11/Samoyed-illo.jpg,"Samoyeds, the smiling sledge dogs, were bred for hard work in the world’s coldest locales. In the Siberian town of Oymyakon, for instance, temperatures of minus-60 degrees are common. The Sammy’s famous white coat is thick enough to protect against such brutal conditions.Powerful, agile, tireless, impervious to cold—Sammies are drop-dead gorgeous but highly functional. Even their most delightful feature, a perpetual smile, has a practical function: The mouth’s upturned corners keep Sammies from drooling, preventing icicles from forming on the face.A Sammy sentenced to solitary confinement in the yard is a miserable—and destructive—creature. These are smart, social, mischievous dogs who demand love and attention. Sammies need a very firm but loving hand in training. As pack animals, they must learn early who the alpha dog is—and the alpha dog must be you. The Samoyed is a substantial but graceful dog standing anywhere from 19 to a bit over 23 inches at the shoulder. Powerful, tireless, with a thick all-white coat impervious to cold—Sammies are perfectly beautiful but highly functional. Even their most delightful feature, a perpetual smile, has a practical function: The upturned corners of the mouth keep Sammies from drooling, preventing icicles from forming on the face.",48.26,59.69,15.875732950000002,29.48350405,12.0,14.0,Working Group
Scottish Terrier,5,3,2,2,3,2,Wiry,Medium,3,4,5,4,3,3,4,4,https://www.akc.org/dog-breeds/scottish-terrier/,https://www.akc.org/wp-content/uploads/2017/11/Scottish-Terrier-Illo-2.jpg,"The well-known Scottie silhouette is that of a short-legged but substantial terrier with distinctive furnishings at the beard, legs, and lower body. The wiry topcoat and soft, dense undercoat coat can be black, wheaten yellow, or a brindle-stripe pattern. Bright, piercing eyes, and erect ears and tail, convey keen alertness—a hallmark of Britain’s terrier breeds.The Scottie working style has been described as efficient and businesslike, and their aloofness toward strangers makes them excellent watchdogs. Their hunting instinct remains strong, which can complicate life for the neighbor’s cat, and Scotties are known to be cantankerous around other dogs. This bold and clever Scotsman enjoys brisk walks and upbeat play. A solidly compact dog of vivid personality, the Scottish Terrier is an independent, confident companion of high spirits. Scotties have a dignified, almost-human character. Their terrier persistence has earned the breed the nickname “the Diehard.”",25.4,25.4,8.164662660000001,9.97903214,12.0,12.0,Terrier Group
Soft Coated Wheaten Terrier,5,5,3,1,4,2,Wavy,Medium,3,3,3,3,3,4,3,3,https://www.akc.org/dog-breeds/soft-coated-wheaten-terrier/,https://www.akc.org/wp-content/uploads/2017/11/Soft-Coated-Wheaten-Terrier-Illo.jpg,"The hallmark of these merry extroverts, and what sets them apart from other terriers, is the silky, gently waving coat. It runs from a pale beige to a shimmering gold, recalling the color of ripening wheat. Topping out at 19 inches tall and 40 pounds, Wheatens are square, sturdy terriers with a peek-a-boo hairdo and dashing goatee. The overall picture is that of a hard-muscled but soft-coated working terrier or, as the breed has been described, an iron fist in a velvet glove. The Soft Coated Wheaten Terrier, an exuberant Irish farm dog, is happy, friendly, deeply devoted, and just stubborn enough to remind you he’s a terrier. The unique wheaten coat is low-shedding but needs diligent care to avoid matting.",43.18,48.26,13.6077711,18.1436948,12.0,14.0,Terrier Group
Whippet,5,5,5,2,1,1,Smooth,Short,3,4,3,3,3,4,1,4,https://www.akc.org/dog-breeds/whippet/,https://www.akc.org/wp-content/uploads/2017/11/Whippet-Illo-2.jpg,"At somewhere between 18 and 22 inches at the shoulder, the Whippet looks like a Greyhound, but smaller. The Whippet exhibits the classic “inverted S” lines of the sighthound. The deep chest and trim waist; a lean head supported by a long, arched neck; and slim but sturdy legs combine in a picture of an agile, fleet-footed athlete.Between bursts of intense pursuit, Whippets love to stretch out and relax for long hours, enjoying the role of a loving, and loved, companion. Whippets like a fenced yard to run in, but they do nicely in cozy apartments too—as long as they are exercised properly. Another plus for city dwellers: Whippets rarely bark. Despite the breed’s elegant looks, the Whippet is a robust, low-maintenance dog. The sleek, sweet-faced Whippet, the “Poor Man’s Racehorse,” is lightning quick. He is an amiable, dignified, and gentle soul, but give him something to chase and he’s all business. The name Whippet is synonymous with streamlined grace.",45.72,55.88,11.33980925,18.1436948,12.0,15.0,Hound Group
Chinese Shar-Pei,4,3,3,3,1,3,Smooth,Short,3,3,4,4,3,3,3,3,https://www.akc.org/dog-breeds/chinese-shar-pei/,https://www.akc.org/wp-content/uploads/2017/11/Chinese-Shar-Pei-Illo-2.jpg,"The compact, medium-sized Chinese Shar-Pei is an amalgam of odd physical traits: a broad “hippopotamus” muzzle; a blue-black tongue; small, sunken eyes with a scowling expression; tiny triangular ears; abundant folds of loose skin about the head, neck, and shoulders; the tapered high-set tail—all blanketed by a harsh, sandpapery coat. (A literal translation of Shar-Pei: “sand skin.”)Shar-Pei are strong, regal, independent guardians famous for intelligence and loyalty. They are suspicious of strangers and other dogs. Shar-Pei are serene dogs, but they will meet a perceived threat with tenacity and vigor. Early training and socialization are essential—a dominant adult Shar-Pei without them is a serious problem waiting to happen. This fascinating but challenging breed of ancient pedigree is steadfastly loyal to family, but standoffish with strangers. The Chinese Shar-Pei has physical characteristics that make him a one-of-a-kind companion and guardian dog.",45.72,50.8,20.41165665,27.2155422,8.0,12.0,Non-Sporting Group
Airedale Terrier,3,3,3,1,3,1,Wiry,Short,3,3,5,3,3,3,3,3,https://www.akc.org/dog-breeds/airedale-terrier/,https://www.akc.org/wp-content/uploads/2017/11/Airedale-Terrier-illustration.jpg,"The Airedale Terrier is the largest of all terrier breeds. Males stand about 23 inches at the shoulder, females a little less. The dense, wiry coat is tan with black markings. Long, muscular legs give Airedales a regal lift in their bearing, and the long head—with its sporty beard and mustache, dark eyes, and neatly folded ears—conveys a keen intelligence. Airedales are the very picture of an alert and willing terrier—only bigger. And, like his smaller cousins in the terrier family, he can be bold, determined, and stubborn. Airedales are docile and patient with kids but won’t back down when protecting hearth and home. Thanks to their famous do-it-all attitude, Airedales excel in all kinds of sports and family activities. His size, strength, and unflagging spirit have earned the Airedale Terrier the nickname “The King of Terriers.” The Airedale stands among the world’s most versatile dog breeds and has distinguished himself as hunter, athlete, and companion.",58.42,58.42,22.6796185,31.751465900000003,11.0,14.0,Terrier Group
Wirehaired Pointing Griffon,5,5,3,3,2,3,Wiry,Medium,5,4,3,4,5,5,3,5,https://www.akc.org/dog-breeds/wirehaired-pointing-griffon/,https://www.akc.org/wp-content/uploads/2017/11/Wirehaired-Pointing-Griffon-Illo-2.jpg,"Griffs are medium-sized, all-purpose gundogs standing no higher than 24 inches at the shoulder. They’re known for an extremely harsh and bristly coat that gives them a natural, unkempt appearance. The preferred color is steel gray with brown markings. A lavish mustache and eyebrows frame large, rounded eyes that gleam with a keen intelligence. Griffs are the very picture of an honest, hardworking sporting dog, whose handsome looks are the result of a noble and unaffected ruggedness rather than fussy grooming. The hardworking Wirehaired Pointing Griffon, renowned as the “supreme gundog,” is known for the harsh, low-shedding coat the breed is named for. Outgoing, eager, and quick-witted, Griffs are incomparable in the field and loving at home.",50.8,60.96,15.875732950000002,31.751465900000003,12.0,15.0,Sporting Group
Bull Terrier,4,3,1,3,2,1,Smooth,Short,4,4,3,3,3,4,3,4,https://www.akc.org/dog-breeds/bull-terrier/,https://www.akc.org/wp-content/uploads/2017/11/Bull-Terrrier-Illo.jpg,"Bull Terriers are robust, big-boned terriers who move with a jaunty stride suggesting agility and power. The breed’s hallmark is a long, egg-shaped head with erect and pointed ears, and small, triangular eyes that glisten with good humor. Coats come in two types: white; and any other color (including an attractive brindle striping), either solid or with white markings. A well-made BT is the picture of muscular determination and balance. There are four keys to BT happiness: early socialization with dogs and people; firm but loving training; ample exercise; and lots of quality time with his adored humans. If these requirements are met, there is no more loyal, lovable, and entertaining companion. This is the ultimate “personality breed.” Among the most comical and mischievous citizens of dogdom, the Bull Terrier is playful and endearing, sometimes stubborn, but always devoted. These unique “eggheads” are exuberant, muscular companions who thrive on affection and exercise.",53.34,55.88,22.6796185,31.751465900000003,12.0,13.0,Terrier Group
Alaskan Malamute,3,3,3,3,3,1,Double,Medium,3,3,4,3,5,4,3,3,https://www.akc.org/dog-breeds/alaskan-malamute/,https://s3.amazonaws.com/cdn-origin-etr.akc.org/wp-content/uploads/2017/11/09152345/Alaskan-Malamute-illustration.jpg,"The Alaskan Malamute stands 23 to 25 inches at the shoulder and weighs 75 to 85 pounds. Everything about Mals suggests their origin as an arctic sled dog: The heavy bone, deep chest, powerful shoulders, and dense, weatherproof coat all scream, “I work hard for a living!” But their almond-shaped brown eyes have an affectionate sparkle, suggesting Mals enjoy snuggling with their humans when the workday is done. Mals are pack animals. And in your family “pack,” the leader must be you. If a Mal doesn’t respect you, he will wind up owning you instead of the other way around. Firm but loving training should begin in early puppyhood. That said, a well-behaved Mal is a joy to be with—playful, gentle, friendly, and great with kids. An immensely strong, heavy-duty worker of spitz type, the Alaskan Malamute is an affectionate, loyal, and playful but dignified dog recognizable by his well-furred plumed tail carried over the back, erect ears, and substantial bone.",58.42,63.5,34.01942775,38.55535145,10.0,14.0,Working Group
Cardigan Welsh Corgi,4,4,3,3,2,1,Double,Medium,4,4,3,3,4,4,5,4,https://www.akc.org/dog-breeds/cardigan-welsh-corgi/,https://www.akc.org/wp-content/uploads/2019/03/Cardigan-Welsh-Corgi-Illo-2.jpg,"Long, low-set dogs with sturdy bone, short legs, and a deep chest, Cardigans are powerful workers of deceptive speed and grace. Cardis can weigh anywhere from 25 to 34 pounds, with females at the lower end of the scale. They come in several coat colors, from red to the popular blue-merle pattern. The quickest way to distinguish Cardis from their cousins, Pembroke Welsh Corgis, is to check out the hindquarters: Cardigans have tails; Pembrokes do not.Cardis are trainable, faithful, and vigilant guardians with a “big dog” bark. Well-socialized Cardis are especially fond of kids and agreeable with other pets. These athletic, rugged herders have a love for the outdoors, and they thrive on mental stimulation and physical activity. The Cardigan Welsh Corgi is a masterpiece of the breeder’s art: Every aspect of its makeup is perfectly suited to moving cattle, and yet it is so congenial and sweet-faced that it would be a cherished companion even if it never did a day’s work.",26.67,31.75,11.33980925,17.23651006,12.0,15.0,Herding Group
Giant Schnauzer,5,3,3,3,4,2,Wiry,Medium,3,4,5,4,5,5,3,4,https://www.akc.org/dog-breeds/giant-schnauzer/,https://www.akc.org/wp-content/uploads/2017/11/Giant-Schnauzer-Illo-2.jpg,"A well-bred Giant Schnauzer closely resembles the Standard Schnauzer—only bigger. As their name suggests, Giants are imposing.A male might stand as high as 27.5 inches at the shoulder and weigh 95 pounds. The muscular, substantial body is, as the breed’s fanciers put it, a “bold and valiant figure of a dog.” The double coat is either solid black or “pepper and salt.” Familiar characteristics of the Mini, Standard, and Giant are a harsh beard and eyebrows, accentuating a keen, sagacious expression. The Giant Schnauzer is a larger and more powerful version of the Standard Schnauzer, and he should, as the breed standard says, be a “bold and valiant figure of a dog.” Great intelligence and loyalty make him a stellar worker and companion.",59.69,69.85,24.947580350000003,38.55535145,12.0,15.0,Working Group
Old English Sheepdog,5,5,3,3,4,3,Double,Long,3,4,4,4,4,3,3,4,https://www.akc.org/dog-breeds/old-english-sheepdog/,https://www.akc.org/wp-content/uploads/2017/11/Old-English-Sheepdog-Illo-2.jpg,"Beneath the Old English Sheepdog’s profuse double coat is a muscular and compact drover, with plenty of bone and a big rump, standing 21 or 22 inches at the shoulder. Their eyes (when you can see them) are dark brown, or blue, or one of each. The OES breed standard says the skull is “capacious and rather squarely formed, giving plenty of room for brain power.”OES move with a bear-like shuffle but are famous for their nimbleness afoot. Regular exercise is required for these strong, able-bodied workers. Equally famed are their many fine housedog qualities: watchfulness, courage, kindliness, and intelligence. Great with children, OES make patient, protective playmates. They are sensible watchdogs known for a loud, ringing bark. The Old English Sheepdog is the archetypical shaggy dog, famous for his profuse coat and peak-a-boo hairdo, a distinctive bear-like gait, and a mellow, agreeable nature. The OES is a big, agile dog who enjoys exploring and a good romp.",53.34,55.88,27.2155422,45.359237,10.0,12.0,Herding Group
Italian Greyhound,5,3,5,3,1,1,Smooth,Short,5,4,3,4,4,3,3,3,https://www.akc.org/dog-breeds/italian-greyhound/,https://www.akc.org/wp-content/uploads/2017/11/Italian-Greyhound-Illo-2.jpg,"IGs are Greyhounds in miniature—more slender, but a Greyhound’s equal in grace and elegance. Standing ideally 13 to 15 inches at the shoulder, they present the sleek, curving lines common to all coursing hounds. Distinguishing features are the long, fine-boned legs.IGs combine the attentiveness of lapdogs with the complexity of ancient, aristocratic hounds. Bred for centuries to be doting companions and jesters, these high-stepping charmers refuse to be ignored. “On the whole,” writes an IG expert, “the breed would much rather be in your lap or bed than on the floor.” They are, though, true sighthounds and will bolt after quick-moving prey at the drop of a cat. A short-coat, low-fat breed, IGs require extra care in cold weather A true Greyhound in miniature, the elegant Italian Greyhound is an alert, playful, and highly affectionate toy companion. IGs make decorative couch dogs, but at heart they are flash-and-dash coursing hounds with an instinct for pursuit.",33.02,38.1,3.17514659,6.35029318,14.0,15.0,Toy Group
Russell Terrier,5,3,5,3,2,1,Wiry,Short,5,5,4,4,3,5,4,5,https://www.akc.org/dog-breeds/russell-terrier/,https://www.akc.org/wp-content/uploads/2017/11/Russell-Terrier-illustration.jpg,"These jaunty little fellows pack lots of personality into a compact, rectangular body standing 10 to 12 inches at the shoulder. Their dark, almond-shaped eyes and mobile V-shaped ears bring out the keenly intelligent expression—an endearing hallmark of the breed. All three coat types are mostly white with markings that are tan or black, or both. Russells move with a free, effortless gait that announces the breed’s innate confidence. Upbeat, lively, inquisitive, and friendly, the jaunty Russell Terrier was developed by England's ""Sporting Parson"" for use in foxhunts. The adorable Russell Terrier looks like a plush toy come to life but is an eager, tireless working terrier.",25.4,30.48,4.082331330000001,6.80388555,12.0,14.0,Terrier Group
Cairn Terrier,4,3,3,2,2,1,Wiry,Medium,3,4,4,3,3,3,4,3,https://www.akc.org/dog-breeds/cairn-terrier/,https://www.akc.org/wp-content/uploads/2017/11/Cairn-Terrier-Illo-2.jpg,"The Cairn’s unique qualities, called “Cairnishness,” include a short, wide head and a free-moving, short-legged body that exudes strength but not heaviness, topping out at about 10 inches high and about 15 inches long. The double coat is harsh and wiry on top and downy beneath. A Cairn presents as a small, shaggy, alert dog, with head, tail, and ears up, and eyes shining with intelligence.A British breed club promotes Cairns as the “best little pal in the world.” Cairns are small enough for a lap-top snuggle and sturdy enough for a good romp on the lawn. They do best with lots of close family contact. For owners who cherish the terrier qualities of gameness, independent thinking, and true-blue loyalty, no other breed will do. Cairn Terriers are happy, busy little earthdogs originally bred to fearlessly root out foxes and other small, furred prey in the rocky Scottish countryside. Curious and alert, Cairns like having a place where they can explore and dig.",24.13,25.4,5.8967008100000005,6.35029318,13.0,15.0,Terrier Group
Irish Wolfhound,5,3,4,3,2,2,Wiry,Medium,3,3,5,3,3,3,1,3,https://www.akc.org/dog-breeds/irish-wolfhound/,https://www.akc.org/wp-content/uploads/2017/11/Irish-Wolfhound-Illo-2.jpg,"The amiable Irish Wolfhound is an immense, muscular hound gracefully built along classic Greyhound lines, capable of great speed at the gallop. A male might stand nearly 3 feet at the shoulder and weigh up to 180 pounds. Females will run smaller but are still a whole lot of hound. The rough, hard coat comes in many colors, including white, gray, brindle, red, black, and fawn.IWs are too serene to be fierce guard dogs, but just the sight of them is enough to deter intruders. IWs are characteristically patient with kids, though animals their size should be supervised around small children. Owning an Irish Wolfhound is a unique, rewarding experience—but acquiring a giant galloping hound is a commitment as big as the dog itself. The calm, dignified, and kindly Irish Wolfhound is the tallest of all AKC breeds. Once fearless big-game hunters capable of dispatching a wolf in single combat, Wolfhounds today are the most serene and agreeable of companions.",76.2,81.28,47.62719885,54.4310844,6.0,8.0,Hound Group
Greater Swiss Mountain Dog,5,5,3,3,2,3,Smooth,Short,5,4,4,3,4,4,3,4,https://www.akc.org/dog-breeds/greater-swiss-mountain-dog/,https://www.akc.org/wp-content/uploads/2017/11/Greater-Swiss-Mountain-Dog-Illo-2.jpg,"“Greater” than what? Well, standing as high as 28.5 inches and weighing as much as a midsize human, a Greater Swiss might easily be greater than you.Swissies are immensely strong, yet agile enough to move a flock across the sloping foot of a mountain. The coat is a striking tricolor—black, red, and white. The head and muzzle typically have a white marking (the “blaze”), setting off a sweet expression. Several big mountain-dog breeds are described as “majestic,” but Swissies practically invented the word. The Greater Swiss Mountain Dog is a large, immensely strong worker famous for a dense coat of striking black, red, and white markings. Dependable and faithful Swissies earned their feed as herders, drafters, and all-around pasture dogs.",59.69,72.39,38.55535145,63.502931800000006,8.0,11.0,Working Group
Miniature Pinscher,5,3,4,3,1,1,Smooth,Short,3,4,5,4,3,5,5,5,https://www.akc.org/dog-breeds/miniature-pinscher/,https://www.akc.org/wp-content/uploads/2017/11/Miniature-Pinscher-Illo-2.jpg,"Min Pins are sturdy, compact dogs standing no more than 12.5 inches at the shoulder. The smooth, shiny coat comes in two shades of solid red, or chocolate-and-rust or black-and-rust. The dark, slightly oval eyes and high-set ears help bring out a self-possessed, “big dog” personality. A distinguishing characteristic is the Min Pin’s high-stepping “hackney” gait, reminiscent of a hackney horse at the trot. The leggy Miniature Pinscher is known to fans as the “King of Toys.” This proud, fearless, fun-loving toy breed of lustrous coat and a compact, wedge-shaped physique is a true personality dog, known for a high-stepping “hackney” gait.",25.4,31.75,3.62873896,4.535923700000001,12.0,16.0,Toy Group
Lhasa Apso,5,3,3,1,3,1,Silky,Long,3,3,5,5,3,3,3,3,https://www.akc.org/dog-breeds/lhasa-apso/,https://www.akc.org/wp-content/uploads/2017/11/Lhasa-Apso-Illo-2.jpg,"Standing less than a foot high at the shoulder, Lhasas are small but hardy dogs of aristocratic bearing. They’re famous for a floor-length, flat-hanging coat, parted in the middle and draping each side of the body. A feathery tail curls over the back in the distinct manner of Tibetan breeds. The breed’s fans say the dark, oval-shaped eyes—peeping through lavish facial hair—are the windows of a Lhasa’s merry soul. The complete picture is unmistakably Asian: exotic, elegant, and serenely well balanced. The lavishly coated Lhasa Apso is a thousand-year-old breed who served as sentinels at palaces and monasteries isolated high in the Himalayas. Smart, confident, and complex, Lhasas are family comedians but regally aloof with strangers.",25.4,27.94,5.4431084400000005,8.164662660000001,12.0,15.0,Non-Sporting Group
Chinese Crested,4,3,3,1,2,1,Hairless,Short,4,3,3,4,4,3,3,3,https://www.akc.org/dog-breeds/chinese-crested/,https://www.akc.org/wp-content/uploads/2017/11/Chinese-Crested-Illo-2.jpg,"The Chinese Crested, a lively and alert toy breed standing between 11 and 13 inches high, can be hairless or coated. The hairless variety has smooth, soft skin and tufts of hair on the head, tail, and ankles. The coated variety, called the “powderpuff,” is covered by a soft, silky coat. Besides the coat, there’s very little difference between the powderpuff and his undressed brother. Both varieties are characterized by fine-boned elegance and graceful movement.Cresteds are as fun as they look: playful, loving, and devoted to their humans. The hairless has its advantages: there is no doggy odor, and for obvious reasons shedding isn’t much of a problem. Both varieties are attentive housemates, totally in tune with their family. With their spotted pink skin, spiky “crested” hairdo, furry socks and feathery tail, you can’t mistake the sweet and slender Chinese Crested for any other breed. This frolicsome, ultra-affectionate companion dog is truly a breed apart.",27.94,33.02,3.62873896,5.4431084400000005,13.0,18.0,Toy Group
Coton de Tulear,5,5,5,2,4,1,Double,Long,5,4,3,4,4,3,1,3,https://www.akc.org/dog-breeds/coton-de-tulear/,https://www.akc.org/wp-content/uploads/2017/11/Coton-de-Tulear-Illo-2.jpg,"The Coton de Tulear (KO-Tone Dih TOO-Lay-ARE) is a small, immensely charming dog standing between 9 and 11 inches high and weighing anywhere from 8 to 13 pounds. Cotons are known for a profuse white coat that is as soft as cotton (or, as the French say, “coton”). Their primary job is to provide amusement, comfort, and companionship.The bond between Cotons and their people is so tight that owners discuss it in human terms. Coton fanciers describe them as “witty” companions “at times boisterous but never demanding” and “naturally clownish and lighthearted,” who possess a “remarkably gentle, sympathetic awareness.” Amusing traits of these long-lived jesters include unique vocalizations and a knack for walking on their hind legs. The Coton de Tulear, “Royal Dog of Madagascar,” is a bright, happy-go-lucky companion dog whose favorite activities include clowning, cavorting, and following their special human around the house. The Coton is small but robustly sturdy.",22.86,27.94,3.62873896,6.80388555,15.0,19.0,Non-Sporting Group
